{
  "schema_version": 1,
  "id": "contract.cli.create-agent",
  "record_version": "1.0.0",
  "status": "active",
  "scope": "public",
  "stability": "stable",
  "owner": "CamiloBuilder maintainers",
  "work_order_id": "work-002",
  "change_type": "creates",
  "consumer_ids": ["consumer.cli-user"],
  "guarantees": ["Existing files are preserved"],
  "compatible_changes": ["Add an optional argument"],
  "incompatible_changes": ["Rename the command"],
  "capability_ids": ["capability.create-agent"],
  "dependency_ids": []
}
